{
  "schema_version": "0.1.0",
  "id": "ei:en:safe",
  "capsule_type": "lexeme",
  "surface": {
    "form": "safe",
    "normalized_form": "safe",
    "language": "en",
    "script": "Latn",
    "part_of_speech": "adjective"
  },
  "morphology": {
    "summary": "A compact semantic-control capsule for safe; morphology is not the focus of this seed entry.",
    "segments": [
      {
        "text": "safe",
        "role": "root",
        "source_language": "English",
        "glosses": [
          "risk acceptability"
        ],
        "certainty": "unknown",
        "provenance_refs": [
          "wiktionary-en-safe"
        ]
      }
    ],
    "certainty": "unknown",
    "provenance_refs": [
      "wiktionary-en-safe"
    ]
  },
  "etymology": {
    "summary": "Etymology for safe is intentionally deferred in this semantic-control seed capsule.",
    "lineage": [],
    "certainty": "unknown",
    "provenance_refs": [
      "wiktionary-en-safe"
    ]
  },
  "semantic_drift": {
    "summary": "Semantic-control usage focuses on present operational meaning rather than historical drift for safe.",
    "developments": []
  },
  "present_usage": {
    "summary": "Free from unacceptable risk or harm in the relevant context.",
    "senses": [
      {
        "id": "safe.sense.semantic-control",
        "definition": "Free from unacceptable risk or harm in the relevant context.",
        "register": "general",
        "domains": [
          "communication",
          "agent-control"
        ],
        "connotations": [
          "risk acceptability"
        ],
        "synonyms": [
          "risk acceptability"
        ],
        "examples": [
          {
            "text": "The word safe changes what claims the agent may safely make.",
            "note": "Original EI semantic-control seed example.",
            "provenance_refs": [
              "ei-manual-semantic-control"
            ]
          }
        ],
        "certainty": "inferred",
        "provenance_refs": [
          "wiktionary-en-safe",
          "ei-manual-semantic-control"
        ]
      }
    ]
  },
  "cultural_frame": {
    "summary": "safe appears in communication where tone, risk, evidence, or commitment must be controlled.",
    "frames": [
      {
        "label": "semantic control",
        "description": "Frames safe as a term whose pragmatic force can change the safe output path.",
        "communities": [
          "AI evaluation",
          "support operations"
        ],
        "certainty": "inferred",
        "provenance_refs": [
          "ei-manual-semantic-control"
        ]
      }
    ]
  },
  "pragmatics": {
    "summary": "Safety claims require evidence because they can change user behavior under risk.",
    "stances": [
      {
        "label": "control-sensitive",
        "valence": "context_dependent",
        "description": "Safety claims require evidence because they can change user behavior under risk.",
        "cues": [
          "safe",
          "risk acceptability"
        ],
        "certainty": "inferred",
        "provenance_refs": [
          "ei-manual-semantic-control"
        ]
      }
    ]
  },
  "expansion": {
    "paragraph": "safe is represented here as a semantic-control term: its present usage and pragmatic force help decide whether an agent should ask, check evidence, avoid overclaiming, or revise before export.",
    "trace": [
      {
        "layer": "present_usage",
        "contribution": "Free from unacceptable risk or harm in the relevant context.",
        "provenance_refs": [
          "wiktionary-en-safe"
        ]
      },
      {
        "layer": "pragmatics",
        "contribution": "Safety claims require evidence because they can change user behavior under risk.",
        "provenance_refs": [
          "ei-manual-semantic-control"
        ]
      }
    ]
  },
  "capsule_summary": "Semantic-control seed capsule for safe: Free from unacceptable risk or harm in the relevant context.",
  "relations": [],
  "provenance": [
    {
      "id": "wiktionary-en-safe",
      "source_type": "dictionary",
      "citation": "Wiktionary entry for safe.",
      "url": "https://en.wiktionary.org/wiki/safe",
      "note": "Dictionary provenance anchor; semantic-control layers are manual seed analysis."
    },
    {
      "id": "ei-manual-semantic-control",
      "source_type": "manual",
      "citation": "Agent Pattern Labs semantic-control seed analysis.",
      "note": "Manual EI layer analysis for control-sensitive agent eval terms."
    }
  ],
  "uncertainty": {
    "overall": "inferred",
    "unresolved_questions": [
      "Expand etymological lineage before treating this as a full production-candidate lexical capsule.",
      "Add corpus examples for pragmatic cues."
    ]
  }
}
